{
  "$schema": "../../../../schemas/mcp-server.schema.json",
  "name": "aspire",
  "package": "aspire",
  "description": "Ships with the Aspire CLI: reaches a running AppHost to list resources, read its console/structured logs and distributed traces, start and stop resources, and search the Aspire documentation. Declared by the aspire stack because it is the CLI's own agent surface, not a separate install.",
  "homepage": "https://aspire.dev/get-started/aspire-mcp-server/"
}
